{
  "schema": "dsh-researcher/adapter-discovery/v1",
  "client": "codex-app-server-stdio",
  "surface": "codex app-server --stdio JSON-RPC; not Codex Desktop as a whole",
  "locked_runtime": {
    "package": "codex-cli",
    "version": "0.150.0-alpha.12.2",
    "contract_generator": "codex app-server generate-json-schema --experimental",
    "generated_schema_sha256": "920a565e47b9e694e9516d32ad5667d6dfec0e3292ba2edef2434d737b8bc596"
  },
  "sources": [
    {
      "id": "OAI-APP-SERVER",
      "url": "https://developers.openai.com/codex/app-server",
      "retrieved_at": "2026-08-29",
      "supports": ["JSON-RPC transport", "thread/turn/item lifecycle", "approvals", "interrupt", "resume/read", "schema generation"]
    }
  ],
  "artifacts": {
    "native_trace": { "path": "native-trace.json", "sha256": "630dcc540eeab638f41d99aabca4078c3603cf11ee4e9416d10cd36f5602bc46" },
    "native_contract": { "path": "native-contract.json", "sha256": "c5b3e126d0644fccaeaee77c3c1a78603bf095be1ca131230605525850688b46" },
    "expected_host_events": { "path": "expected-host-events.json", "sha256": "8f01621a4f9f8504df5c157173b7f6c3ce2a410aaf69e3d6281069b034dcb10c" },
    "replay_checkpoint": { "path": "replay-checkpoint.json", "sha256": "be0397c1e8c80d8a66a20f1541bffd0b0daa11e8ef29aded2373aba23f48229b" },
    "mapping_report": { "path": "mapping.md", "sha256": "8afc01e9761e916bef6f1a01e2768ac67a4bb2e4b1cc112a26bb12d54fd92e21" }
  },
  "invocation": {
    "function_call": ["researcher.ask", "researcher.mode.set", "researcher.mode.get"],
    "native_aliases": ["future app-server client action; not implemented"]
  },
  "capabilities": {
    "ordered_events": { "status": "DOCUMENTED", "evidence_refs": ["OAI-APP-SERVER", "native-contract.json"] },
    "stable_call_id": { "status": "DOCUMENTED", "evidence_refs": ["native-contract.json", "expected-host-events.json"] },
    "human_approval": { "status": "DOCUMENTED", "evidence_refs": ["OAI-APP-SERVER", "native-contract.json"] },
    "hard_stop": { "status": "DOCUMENTED", "evidence_refs": ["native-contract.json", "expected-host-events.json"] },
    "event_replay": { "status": "DOCUMENTED", "evidence_refs": ["OAI-APP-SERVER", "replay-checkpoint.json"] },
    "usage_coverage": { "status": "DOCUMENTED", "evidence_refs": ["native-contract.json", "expected-host-events.json"] },
    "write_boundary": { "status": "UNKNOWN", "evidence_refs": ["mapping.md"] }
  },
  "gaps": [
    { "id": "C-G1", "severity": "HIGH", "statement": "persisted ThreadItems are documented as lossy for some command executions; raw-first durable replay is unproven" },
    { "id": "C-G2", "severity": "HIGH", "statement": "approval response correlation does not yet bind a stable authenticated human principal" },
    { "id": "C-G3", "severity": "HIGH", "statement": "adapter-owned write-policy and post-terminal enforcement receipts do not exist" },
    { "id": "C-G4", "severity": "MEDIUM", "statement": "usage notification presence does not yet prove coverage of every billable or helper request" }
  ],
  "result": "HOLD",
  "claim_boundary": "Interface discovery only. No Codex adapter, installation path, governed profile, or compatibility claim is delivered."
}
