{
  "schema": "dsh-researcher/adapter-discovery/v1",
  "client": "claude-code-agent-sdk",
  "surface": "@anthropic-ai/claude-agent-sdk local Agent SDK; not Claude Managed Agents",
  "locked_runtime": {
    "package": "@anthropic-ai/claude-agent-sdk",
    "version": "0.3.251",
    "npm_integrity": "sha512-DqSi8mH2tQYRlVV0G+lJnQ/WbjJZ/a+8cJ3vPuYoqh8esIIvXHm1ZOXV1UPGsFYRnbBytEoiSGitguEXd+sQ+Q==",
    "tarball_sha256": "e3ef10500a552356a2923f8bd6bc0dea54f5b6785aaa340157ccb2e1794c1a25"
  },
  "sources": [
    {
      "id": "ANT-CLI",
      "url": "https://docs.anthropic.com/en/docs/claude-code/cli-usage",
      "retrieved_at": "2026-08-29",
      "supports": ["resume by session ID", "permission prompt tool", "non-interactive output"]
    },
    {
      "id": "ANT-TOOL",
      "url": "https://platform.claude.com/docs/en/agents-and-tools/tool-use/handle-tool-calls",
      "retrieved_at": "2026-08-29",
      "supports": ["unique tool-use ID", "tool-result correlation"]
    },
    {
      "id": "ANT-EVENTS",
      "url": "https://platform.claude.com/docs/en/managed-agents/events-and-streaming",
      "retrieved_at": "2026-08-29",
      "supports": ["event persistence principles", "interrupt and resume reference; managed surface only"]
    },
    {
      "id": "NPM-SDK",
      "url": "https://registry.npmjs.org/@anthropic-ai/claude-agent-sdk/-/claude-agent-sdk-0.3.251.tgz",
      "retrieved_at": "2026-08-29",
      "supports": ["locked SDK type contract"]
    }
  ],
  "artifacts": {
    "native_trace": { "path": "native-trace.json", "sha256": "267b059561f28f744f1f097fa0dabb734264959df3c12ac9eeaf455e347b1a65" },
    "native_contract": { "path": "native-contract.json", "sha256": "a2f09a10a58cc3dcaa71091e914fa7112850cbfb2147036d29ba27e685a5827f" },
    "session_api_trace": { "path": "session-api-trace.json", "sha256": "8dadbd204528f5e4d9c040ac7cc2be7121ec5f6e1cf2388d22cb56e055213500" },
    "local_session_fixture_trace": { "path": "local-session-fixture-trace.json", "sha256": "56b55db096ab7cdebb37131268904cbb3f9341494f9c38840a5ae886e46554b4" },
    "expected_host_events": { "path": "expected-host-events.json", "sha256": "5baa70006a46488d9ad120685f8d8c578b8efe2981f6e00f217fbbbf58559d49" },
    "replay_checkpoint": { "path": "replay-checkpoint.json", "sha256": "f0879609ee9cd96980bec8d250dde1736244ffff87e7003434ca12699146cfa2" },
    "mapping_report": { "path": "mapping.md", "sha256": "868f8165ed8a9b12cd6c47a47454ca63ff548b1ac611c1eeb4bbe6e8da5b33c8" }
  },
  "invocation": {
    "function_call": ["researcher.ask", "researcher.mode.set", "researcher.mode.get"],
    "native_aliases": ["future Claude command or MCP alias; not implemented"]
  },
  "capabilities": {
    "ordered_events": { "status": "DOCUMENTED", "evidence_refs": ["native-contract.json"] },
    "stable_call_id": { "status": "DOCUMENTED", "evidence_refs": ["ANT-TOOL", "native-contract.json"] },
    "human_approval": { "status": "DOCUMENTED", "evidence_refs": ["ANT-CLI", "native-contract.json"] },
    "hard_stop": { "status": "DOCUMENTED", "evidence_refs": ["native-contract.json"] },
    "event_replay": { "status": "DOCUMENTED", "evidence_refs": ["ANT-CLI", "replay-checkpoint.json"] },
    "usage_coverage": { "status": "UNKNOWN", "evidence_refs": ["native-contract.json", "mapping.md"] },
    "write_boundary": { "status": "UNKNOWN", "evidence_refs": ["mapping.md"] }
  },
  "gaps": [
    { "id": "A-G1", "severity": "HIGH", "statement": "the locked SDK, native CLI, empty reads, and a host-authored non-empty parser fixture execute successfully, but no authentic query/session/tool trace has been captured" },
    { "id": "A-G2", "severity": "HIGH", "statement": "raw event durability and restart replay are not proven by the package types" },
    { "id": "A-G3", "severity": "HIGH", "statement": "human principal assurance and post-terminal hard-stop receipts are not established" },
    { "id": "A-G4", "severity": "HIGH", "statement": "modelUsage explicitly excludes some helper calls, so strict usage completeness is unknown" },
    { "id": "A-G5", "severity": "HIGH", "statement": "project-root write enforcement is not demonstrated" }
  ],
  "result": "HOLD",
  "claim_boundary": "Version-locked type, runtime-load, isolated empty-read, and host-authored local parser-fixture discovery only. No Claude Code adapter, installation path, governed profile, authentic native session evidence, or compatibility claim is delivered."
}
